{
  "$schema": "https://raw.githubusercontent.com/Kaua-KGzin/System-Arch/main/docs/arch-line.schema.json",
  "line": "arch",
  "protocol": 1,
  "id": "arch-hub",
  "name": "Arch Hub",
  "role": "platform",
  "description": "Catálogo central e monitoramento da linha Arch",
  "repository": "https://github.com/Kaua-KGzin/System-Arch",
  "stack": ["java", "spring-boot"],
  "runtime": "service",
  "defaultPort": 8080,
  "health": "/actuator/health",
  "connectsTo": [],
  "adapter": "src/main/java/dev/kauakgzin/archhub/service/SelfRegistration.java"
}
